{
  "solutionProfileVersion": "1.0",
  "kind": "solution-profile",
  "id": "example.catalog-query-detail.neutral",
  "channelProfileId": "example.catalog-query-detail.representative-mp-weixin",
  "capabilityPackageIds": [
    "example.catalog-query-detail.read",
    "example.catalog-query-detail.acknowledge"
  ]
}
